{"$defs":{"capabilityState":{"enum":["unavailable","offline-validated","gpu-validated","failed"]},"completenessState":{"enum":["planned","running","complete","partial","corrupt","failed"]},"contentRef":{"additionalProperties":false,"properties":{"id":{"$ref":"#/$defs/identifier"},"kind":{"$ref":"#/$defs/identifier"},"schema_version":{"const":"1.0.0"},"sha256":{"$ref":"#/$defs/sha256"},"uri":{"minLength":1,"type":"string"}},"required":["schema_version","kind","id","sha256","uri"],"type":"object"},"identifier":{"pattern":"^[a-z0-9][a-z0-9._:-]{2,127}$","type":"string"},"moduleKind":{"enum":["router-logits","router-probabilities","route-selection","routing-weights","shared-expert-output","residual-stream","attention-input","attention-output","attention-summary","mlp-input","mlp-output","expert-input","expert-output","decoder-logits","token-confidence","kv-metadata","quantization-metadata","runtime-metadata","modality-encoder","modality-projection"]},"sha256":{"pattern":"^[0-9a-f]{64}$","type":"string"}},"$id":"https://inkling-small-ampere.invalid/schemas/mechanistic/v1/InterventionManifest.schema.json","$schema":"https://json-schema.org/draft/2020-12/schema","additionalProperties":false,"properties":{"effect_measures":{"items":{"type":"string"},"type":"array"},"execution_order":{"items":{"type":"string"},"type":"array"},"expected_direction":{"type":"string"},"hypothesis":{"minLength":1,"type":"string"},"id":{"type":"string"},"interventions":{"items":{"additionalProperties":false,"properties":{"expert_ids":{"items":{"type":"integer"},"type":"array"},"id":{"type":"string"},"kind":{"enum":["expert-knockout","expert-attenuation","expert-amplification","expert-reroute","route-freeze","activation-patch","residual-steering","vector-injection","output-ablation","logit-bias","quantization-scale-counterfactual","precision-restoration","kv-patch","context-mask","modality-embedding-swap"]},"layers":{"items":{"type":"integer"},"type":"array"},"module_kind":{"$ref":"#/$defs/moduleKind"},"parameters":{"type":"object"},"source_artifact_ref":{"anyOf":[{"$ref":"#/$defs/contentRef"},{"type":"null"}]},"token_positions":{"items":{"type":"integer"},"type":"array"}},"required":["id","kind","module_kind","layers","token_positions","expert_ids","parameters","source_artifact_ref"],"type":"object"},"minItems":1,"type":"array"},"kind":{"const":"intervention-manifest"},"matched_control_run_ref":{"$ref":"#/$defs/contentRef"},"modality_capabilities":{"additionalProperties":false,"properties":{"audio":{"$ref":"#/$defs/capabilityState"},"image":{"$ref":"#/$defs/capabilityState"},"text":{"$ref":"#/$defs/capabilityState"}},"required":["text","image","audio"],"type":"object"},"safety_constraints":{"items":{"type":"string"},"type":"array"},"schema_version":{"const":"1.0.0"},"seed":{"minimum":0,"type":"integer"}},"required":["schema_version","kind","id","hypothesis","matched_control_run_ref","seed","interventions","execution_order","safety_constraints","effect_measures","expected_direction","modality_capabilities"],"title":"InterventionManifest","type":"object"}
